{
  "operations": [
    {
      "bindings": [],
      "motions": [
        [
          "var",
          "r0",
          "s0"
        ]
      ],
      "operation_id": "operation:final-use-raw-identifier",
      "root": "r0",
      "target": [
        "n1",
        "cap:v1:target:35e73eaf0e0741afefd5ccd2f9fc09b9"
      ]
    }
  ],
  "patch_id": "patch:capability-v2-normalization-policy-001",
  "schema_version": "ai-experiments.semantic-ir.motion-patch/v1",
  "state_token": "cap:v1:state:b1dc47574fa3d042a6ef3707c5c551e2"
}
